<?xml version="1.0" encoding="UTF-8"?>
<datadefs xmlns="http://codetab.org/gotz" xmlns:xsi="http://www.w3.org/2001/XMLSchema-instance"
    xsi:schemaLocation="http://codetab.org/gotz gotz.xsd">
    <datadef name="pl">
        <axis name="col">
            <fields name="group" value="query">
                <field name="region"
                    value="//table//*[count(*)=0 and contains(.,'Employee Cost')]/ancestor::table[1]" />
                <field name="field" value="*//tr[1]/td[%{col.index}+1]" />
            </fields>
            <member name="year">
                <field name="indexRange" value="1-5" />
            </member>
        </axis>
        <axis name="row">
            <fields name="group" value="query">
                <field name="region"
                    value="//table//*[count(*)=0 and contains(.,'Employee Cost')]/ancestor::table[1]" />
                <field name="field" value="*//tr[%{row.index}+0]/td[1]" />
            </fields>
            <member name="item" index="6">
                <!-- <field name="indexRange" value="1-37" /> -->
                <field name="breakAfter" value="Book Value (Rs)" />
            </member>
            <filter axis="row">
                <fields name="group" value="value">
                    <field name="blank" value="" />
                    <field name="f1" value="Expenditure" />
                    <field name="f2" value="Per share data (annualised)" />
                </fields>
            </filter>
        </axis>
        <axis name="fact">
            <fields name="group" value="query">
                <field name="region"
                    value="//table//*[count(*)=0 and contains(.,'Employee Cost')]/ancestor::table[1]" />
                <field name="field"
                    value="*//*[.='%{row.value}']/following-sibling::td[%{col.index}]" />
            </fields>
        </axis>
    </datadef>
</datadefs>


